{
  "schemaVersion": 1,
  "id": "low-rain-5",
  "month": 5,
  "region": "global",
  "theme": "low-rain",
  "indexable": false,
  "entries": [
    {
      "rank": 1,
      "slug": "tenerife",
      "name": "Tenerife",
      "countryCode": "ES",
      "score": 98,
      "tempC": 16,
      "wet": 0.0562,
      "snow": 0
    },
    {
      "rank": 2,
      "slug": "samaria-crete",
      "name": "Samaria Gorge",
      "countryCode": "GR",
      "score": 95,
      "tempC": 17.5,
      "wet": 0.165,
      "snow": 0
    },
    {
      "rank": 3,
      "slug": "blyde-river",
      "name": "Blyde River Canyon",
      "countryCode": "ZA",
      "score": 93,
      "tempC": 19.3,
      "wet": 0.0986,
      "snow": 0
    },
    {
      "rank": 4,
      "slug": "flinders-ranges",
      "name": "Flinders Ranges",
      "countryCode": "AU",
      "score": 93,
      "tempC": 15.7,
      "wet": 0.0968,
      "snow": 0
    },
    {
      "rank": 5,
      "slug": "gila-wilderness",
      "name": "Gila Wilderness",
      "countryCode": "US",
      "score": 93,
      "tempC": 19.7,
      "wet": 0.1373,
      "snow": 0.0018
    },
    {
      "rank": 6,
      "slug": "quebrada-de-humahuaca",
      "name": "Quebrada de Humahuaca",
      "countryCode": "AR",
      "score": 93,
      "tempC": 13.1,
      "wet": 0.0258,
      "snow": 0.0028
    },
    {
      "rank": 7,
      "slug": "escalante",
      "name": "Grand Staircase-Escalante",
      "countryCode": "US",
      "score": 92,
      "tempC": 18.8,
      "wet": 0.1419,
      "snow": 0.0074
    },
    {
      "rank": 8,
      "slug": "mallorca",
      "name": "Mallorca",
      "countryCode": "ES",
      "score": 92,
      "tempC": 20.3,
      "wet": 0.1972,
      "snow": 0
    },
    {
      "rank": 9,
      "slug": "warrumbungle",
      "name": "Warrumbungle",
      "countryCode": "AU",
      "score": 92,
      "tempC": 14.8,
      "wet": 0.1714,
      "snow": 0
    },
    {
      "rank": 10,
      "slug": "zion",
      "name": "Zion",
      "countryCode": "US",
      "score": 92,
      "tempC": 17.9,
      "wet": 0.1576,
      "snow": 0.0175
    },
    {
      "rank": 11,
      "slug": "copper-canyon",
      "name": "Copper Canyon",
      "countryCode": "MX",
      "score": 90,
      "tempC": 21.5,
      "wet": 0.1032,
      "snow": 0
    },
    {
      "rank": 12,
      "slug": "larapinta",
      "name": "Larapinta Trail",
      "countryCode": "AU",
      "score": 90,
      "tempC": 19.6,
      "wet": 0.059,
      "snow": 0
    },
    {
      "rank": 13,
      "slug": "canyonlands",
      "name": "Canyonlands",
      "countryCode": "US",
      "score": 88,
      "tempC": 20.4,
      "wet": 0.1235,
      "snow": 0.0028
    },
    {
      "rank": 14,
      "slug": "chapada-dos-veadeiros",
      "name": "Chapada dos Veadeiros",
      "countryCode": "BR",
      "score": 88,
      "tempC": 23.5,
      "wet": 0.1705,
      "snow": 0
    },
    {
      "rank": 15,
      "slug": "anti-atlas",
      "name": "Anti-Atlas",
      "countryCode": "MA",
      "score": 86,
      "tempC": 21.5,
      "wet": 0.118,
      "snow": 0
    },
    {
      "rank": 16,
      "slug": "arches",
      "name": "Arches",
      "countryCode": "US",
      "score": 86,
      "tempC": 20.8,
      "wet": 0.13,
      "snow": 0.0018
    },
    {
      "rank": 17,
      "slug": "grand-canyon",
      "name": "Grand Canyon",
      "countryCode": "US",
      "score": 85,
      "tempC": 22.4,
      "wet": 0.1088,
      "snow": 0.0018
    },
    {
      "rank": 18,
      "slug": "karijini",
      "name": "Karijini",
      "countryCode": "AU",
      "score": 83,
      "tempC": 23.3,
      "wet": 0.0857,
      "snow": 0
    },
    {
      "rank": 19,
      "slug": "dana-jordan",
      "name": "Dana Biosphere Reserve",
      "countryCode": "JO",
      "score": 81,
      "tempC": 24.3,
      "wet": 0.0147,
      "snow": 0
    },
    {
      "rank": 20,
      "slug": "hoggar",
      "name": "Hoggar Mountains",
      "countryCode": "DZ",
      "score": 77,
      "tempC": 26.7,
      "wet": 0.0341,
      "snow": 0
    }
  ]
}
